{
  "schema_version": "1.0",
  "project_id": "yt-smoke0p3aa",
  "language": "fa",
  "dialect": null,
  "engine": {
    "provider": "manual",
    "model": null,
    "word_alignment": null,
    "version": null
  },
  "duration_seconds": 6.0,
  "cues": [
    {
      "id": 0,
      "start_ms": 0,
      "end_ms": 2500,
      "text": "سلام، من درباره انقلاب صحبت می‌کنم.",
      "confidence": -0.2
    },
    {
      "id": 1,
      "start_ms": 2500,
      "end_ms": 6000,
      "text": "این یک جمله دوم برای آزمایش است.",
      "confidence": -0.3
    }
  ],
  "has_word_timing": false,
  "created_at": "2026-08-03T05:34:45Z",
  "created_by": "human"
}
